{"$schema":"https://json-schema.org/draft/2020-12/schema","title":"Syntra external adapter manifest","type":"object","required":["manifest_version","protocol_version","id","name","executable","capabilities"],"properties":{"manifest_version":{"const":1},"protocol_version":{"const":1},"id":{"type":"string","pattern":"^[A-Za-z0-9._-]+$"},"name":{"type":"string","minLength":1},"executable":{"type":"string","minLength":1},"args":{"type":"array","items":{"type":"string"}},"capabilities":{"type":"object","required":["clipboard_read","paste","cancel","mime_types"],"properties":{"clipboard_read":{"type":"boolean"},"paste":{"type":"boolean"},"cancel":{"type":"boolean"},"requires_live_mount":{"type":"boolean","default":false},"mime_types":{"type":"array","minItems":1,"uniqueItems":true,"items":{"type":"string","minLength":1}}},"additionalProperties":false}},"additionalProperties":false}
