{"manifest_version":1,"protocol_version":1,"id":"coolfilebrowser","name":"CoolFileBrowser","executable":"coolfilebrowser-lan-mouse-adapter","args":[],"capabilities":{"clipboard_read":true,"paste":true,"cancel":true,"requires_live_mount":false,"mime_types":["text/uri-list","x-special/gnome-copied-files"]}}
